Sheet: Sheet1
A1: Purchase Date | B1: ID Fragment | C1: Name | D1: Quantity | E1: Individual Cost (at time of writing, Using the source’s currency) | F1: Note | H1: Proportion | I1: Adjusted Item Cost (AUD) | J1: Calculated Shipping + Fees (AUD) | L1: Adjusted Item Cost (Rounded, AUD) | M1: Calculated Shipping + Fees (Rounded AUD) | N1: Item Cost Error (*10000) | O1: Shipping/Fees Error (*1000)
A2: 2022-05-02 | B2: ALL-CAPS-AU | C2: BuiltByNim Linear | D2: 1 | E2: of:=9.5/10 -> 0.95 | H2: of:=[.E2]/[.$E$13] -> 0.115974886641088 | I2: of:=[.H2]*[.$R$2] -> 1.15974886641088 | J2: of:=[.H2]*[.$R$3] -> 0.207595047087548 | L2: of:=MROUND([.I2];0.01) -> 1.16 | M2: of:=MROUND([.J2];0.01) -> 0.21 | Q2: Actual Total Item Cost (AUD) | R2: 10
A3: 2022-05-02 | B3: ALL-CAPS-AU | C3: Charue Design Ca Phe Sua Da | D3: 1 | E3: of:=8.5/10 -> 0.85 | H3: of:=[.E3]/[.$E$13] -> 0.103767003836763 | I3: of:=[.H3]*[.$R$2] -> 1.03767003836763 | J3: of:=[.H3]*[.$R$3] -> 0.185742936867806 | L3: of:=MROUND([.I3];0.01) -> 1.04 | M3: of:=MROUND([.J3];0.01) -> 0.19 | Q3: Actual Shipping Cost (AUD) | R3: 1.79
A4: 2022-05-02 | B4: ALL-CAPS-AU | C4: Charue Design Popcorn | D4: 1 | E4: of:=8.5/10 -> 0.85 | H4: of:=[.E4]/[.$E$13] -> 0.103767003836763 | I4: of:=[.H4]*[.$R$2] -> 1.03767003836763 | J4: of:=[.H4]*[.$R$3] -> 0.185742936867806 | L4: of:=MROUND([.I4];0.01) -> 1.04 | M4: of:=MROUND([.J4];0.01) -> 0.19
A5: 2022-05-02 | B5: ALL-CAPS-AU | C5: Cherry Hyperglide MX (Black) | D5: 1 | E5: of:=48/70 -> 0.685714285714286 | H5: of:=[.E5]/[.$E$13] -> 0.0837111963725148 | I5: of:=[.H5]*[.$R$2] -> 0.837111963725148 | J5: of:=[.H5]*[.$R$3] -> 0.149843041506802 | L5: of:=MROUND([.I5];0.01) -> 0.84 | M5: of:=MROUND([.J5];0.01)-0.01 -> 0.14
A6: 2022-05-02 | B6: ALL-CAPS-AU | C6: Cherry Hyperglide MX (Brown) | D6: 1 | E6: of:=48/70 -> 0.685714285714286 | H6: of:=[.E6]/[.$E$13] -> 0.0837111963725148 | I6: of:=[.H6]*[.$R$2] -> 0.837111963725148 | J6: of:=[.H6]*[.$R$3] -> 0.149843041506802 | L6: of:=MROUND([.I6];0.01) -> 0.84 | M6: of:=MROUND([.J6];0.01)-0.01 -> 0.14
A7: 2022-05-02 | B7: ALL-CAPS-AU | C7: Gateron Cap Yellow V2 | D7: 1 | E7: of:=46.9/70 -> 0.67 | H7: of:=[.E7]/[.$E$13] -> 0.081792814788978 | I7: of:=[.H7]*[.$R$2] -> 0.81792814788978 | J7: of:=[.H7]*[.$R$3] -> 0.146409138472271 | L7: of:=MROUND([.I7];0.01) -> 0.82 | M7: of:=MROUND([.J7];0.01) -> 0.15
A8: 2022-05-02 | B8: ALL-CAPS-AU | C8: Gateron Pro Milky Yellow | D8: 1 | E8: of:=23.1/70 -> 0.33 | H8: of:=[.E8]/[.$E$13] -> 0.0402860132542728 | I8: of:=[.H8]*[.$R$2] -> 0.402860132542728 | J8: of:=[.H8]*[.$R$3] -> 0.0721119637251482 | L8: of:=MROUND([.I8];0.01) -> 0.4 | M8: of:=MROUND([.J8];0.01) -> 0.07
A9: 2022-05-02 | B9: ALL-CAPS-AU | C9: Infinity Key Cow (POM Stem) | D9: 1 | E9: of:=9.1/10 -> 0.91 | H9: of:=[.E9]/[.$E$13] -> 0.111091733519358 | I9: of:=[.H9]*[.$R$2] -> 1.11091733519358 | J9: of:=[.H9]*[.$R$3] -> 0.198854202999651 | L9: of:=MROUND([.I9];0.01) -> 1.11 | M9: of:=MROUND([.J9];0.01) -> 0.2
A10: 2022-05-02 | B10: ALL-CAPS-AU | C10: Infinity Key Cow (UHMWPE Stem) | D10: 1 | E10: of:=9.1/10 -> 0.91 | H10: of:=[.E10]/[.$E$13] -> 0.111091733519358 | I10: of:=[.H10]*[.$R$2] -> 1.11091733519358 | J10: of:=[.H10]*[.$R$3] -> 0.198854202999651 | L10: of:=MROUND([.I10];0.01) -> 1.11 | M10: of:=MROUND([.J10];0.01) -> 0.2
A11: 2022-05-02 | B11: ALL-CAPS-AU | C11: Kailh Black | D11: 1 | E11: of:=4/10 -> 0.4 | H11: of:=[.E11]/[.$E$13] -> 0.0488315312173003 | I11: of:=[.H11]*[.$R$2] -> 0.488315312173003 | J11: of:=[.H11]*[.$R$3] -> 0.0874084408789676 | L11: of:=MROUND([.I11];0.01)-0.01 -> 0.48 | M11: of:=MROUND([.J11];0.01) -> 0.09
A12: 2022-05-02 | B12: ALL-CAPS-AU | C12: Rebult Keyboards Penyu | D12: 1 | E12: of:=9.5/10 -> 0.95 | H12: of:=[.E12]/[.$E$13] -> 0.115974886641088 | I12: of:=[.H12]*[.$R$2] -> 1.15974886641088 | J12: of:=[.H12]*[.$R$3] -> 0.207595047087548 | L12: of:=MROUND([.I12];0.01) -> 1.16 | M12: of:=MROUND([.J12];0.01) -> 0.21
C13: (TOTAL) | D13: of:=SUM([.D2:.D12]) -> 11 | E13: of:=SUM([.E2:.E12]) -> 8.19142857142857 | H13: of:=SUM([.H2:.H12]) -> 1 | I13: of:=SUM([.I2:.I12]) -> 10 | J13: of:=SUM([.J2:.J12]) -> 1.79 | L13: of:=SUM([.L2:.L12]) -> 10 | M13: of:=SUM([.M2:.M12]) -> 1.79
A15: 2022-05-02 | B15: KBDfans-CN | C15: Cherry Hyperglide MX (Red) | D15: 1 | E15: of:=3.5/10 -> 0.35 | H15: of:=[.E15]/[.$E$87] -> 0.0113562621674238 | I15: of:=[.H15]*[.$R$15] -> 0.529201817001947 | J15: of:=[.H15]*[.$R$16] -> 0.102206359506814 | L15: of:=MROUND([.I15];0.01)+0.01 -> 0.54 | M15: of:=MROUND([.J15];0.01) -> 0.1 | Q15: Actual Total Item Cost (AUD) | R15: 46.6
A16: 2022-05-02 | B16: KBDfans-CN | C16: Cherry Hyperglide MX (Black) | D16: 1 | E16: of:=3.5/10 -> 0.35 | H16: of:=[.E16]/[.$E$87] -> 0.0113562621674238 | I16: of:=[.H16]*[.$R$15] -> 0.529201817001947 | J16: of:=[.H16]*[.$R$16] -> 0.102206359506814 | L16: of:=MROUND([.I16];0.01)+0.01 -> 0.54 | M16: of:=MROUND([.J16];0.01) -> 0.1 | Q16: Actual Shipping Cost (AUD) | R16: 9
A17: 2022-05-02 | B17: KBDfans-CN | C17: Cherry Hyperglide MX (Brown) | D17: 1 | E17: of:=3.5/10 -> 0.35 | H17: of:=[.E17]/[.$E$87] -> 0.0113562621674238 | I17: of:=[.H17]*[.$R$15] -> 0.529201817001947 | J17: of:=[.H17]*[.$R$16] -> 0.102206359506814 | L17: of:=MROUND([.I17];0.01)+0.01 -> 0.54 | M17: of:=MROUND([.J17];0.01) -> 0.1
A18: 2022-05-02 | B18: KBDfans-CN | C18: Cherry Hyperglide MX (Clear) | D18: 1 | E18: of:=5.9/10 -> 0.59 | H18: of:=[.E18]/[.$E$87] -> 0.0191434133679429 | I18: of:=[.H18]*[.$R$15] -> 0.892083062946139 | J18: of:=[.H18]*[.$R$16] -> 0.172290720311486 | L18: of:=MROUND([.I18];0.01) -> 0.89 | M18: of:=MROUND([.J18];0.01)+0.01 -> 0.18
A19: 2022-05-02 | B19: KBDfans-CN | C19: Cherry Hyperglide MX (Blue) | D19: 1 | E19: of:=3.5/10 -> 0.35 | H19: of:=[.E19]/[.$E$87] -> 0.0113562621674238 | I19: of:=[.H19]*[.$R$15] -> 0.529201817001947 | J19: of:=[.H19]*[.$R$16] -> 0.102206359506814 | L19: of:=MROUND([.I19];0.01)+0.01 -> 0.54 | M19: of:=MROUND([.J19];0.01) -> 0.1
A20: 2022-05-02 | B20: KBDfans-CN | C20: Cherry Hyperglide MX (Green) | D20: 1 | E20: of:=3.5/10 -> 0.35 | H20: of:=[.E20]/[.$E$87] -> 0.0113562621674238 | I20: of:=[.H20]*[.$R$15] -> 0.529201817001947 | J20: of:=[.H20]*[.$R$16] -> 0.102206359506814 | L20: of:=MROUND([.I20];0.01)+0.01 -> 0.54 | M20: of:=MROUND([.J20];0.01) -> 0.1
A21: 2022-05-02 | B21: KBDfans-CN | C21: Cherry Hyperglide MX (Green) | D21: 1 | E21: of:=3.5/10 -> 0.35 | H21: of:=[.E21]/[.$E$87] -> 0.0113562621674238 | I21: of:=[.H21]*[.$R$15] -> 0.529201817001947 | J21: of:=[.H21]*[.$R$16] -> 0.102206359506814 | L21: of:=MROUND([.I21];0.01)+0.01 -> 0.54 | M21: of:=MROUND([.J21];0.01) -> 0.1
A22: 2022-05-02 | B22: KBDfans-CN | C22: Cherry Hyperglide MX (White) | D22: 1 | E22: of:=3.5/10 -> 0.35 | H22: of:=[.E22]/[.$E$87] -> 0.0113562621674238 | I22: of:=[.H22]*[.$R$15] -> 0.529201817001947 | J22: of:=[.H22]*[.$R$16] -> 0.102206359506814 | L22: of:=MROUND([.I22];0.01)+0.01 -> 0.54 | M22: of:=MROUND([.J22];0.01) -> 0.1
A23: 2022-05-02 | B23: KBDfans-CN | C23: Cherry Hyperglide MX (Speed Silver) | D23: 1 | E23: of:=3.8/10 -> 0.38 | H23: of:=[.E23]/[.$E$87] -> 0.0123296560674886 | I23: of:=[.H23]*[.$R$15] -> 0.574561972744971 | J23: of:=[.H23]*[.$R$16] -> 0.110966904607398 | L23: of:=MROUND([.I23];0.01) -> 0.57 | M23: of:=MROUND([.J23];0.01) -> 0.11
A24: 2022-05-02 | B24: KBDfans-CN | C24: Cherry Hyperglide MX (Gray) | D24: 1 | E24: of:=5.9/10 -> 0.59 | H24: of:=[.E24]/[.$E$87] -> 0.0191434133679429 | I24: of:=[.H24]*[.$R$15] -> 0.892083062946139 | J24: of:=[.H24]*[.$R$16] -> 0.172290720311486 | L24: of:=MROUND([.I24];0.01) -> 0.89 | M24: of:=MROUND([.J24];0.01) -> 0.17
A25: 2022-05-02 | B25: KBDfans-CN | C25: Cherry Hyperglide MX (Silent Red) | D25: 1 | E25: of:=5.5/10 -> 0.55 | H25: of:=[.E25]/[.$E$87] -> 0.017845554834523 | I25: of:=[.H25]*[.$R$15] -> 0.831602855288774 | J25: of:=[.H25]*[.$R$16] -> 0.160609993510707 | L25: of:=MROUND([.I25];0.01) -> 0.83 | M25: of:=MROUND([.J25];0.01) -> 0.16
A26: 2022-05-02 | B26: KBDfans-CN | C26: Cherry Hyperglide MX (Silent Black) | D26: 1 | E26: of:=5.5/10 -> 0.55 | H26: of:=[.E26]/[.$E$87] -> 0.017845554834523 | I26: of:=[.H26]*[.$R$15] -> 0.831602855288774 | J26: of:=[.H26]*[.$R$16] -> 0.160609993510707 | L26: of:=MROUND([.I26];0.01) -> 0.83 | M26: of:=MROUND([.J26];0.01) -> 0.16
A27: 2022-05-02 | B27: KBDfans-CN | C27: Cherry Hyperglide MX RGB (Red) | D27: 1 | E27: of:=4/10 -> 0.4 | H27: of:=[.E27]/[.$E$87] -> 0.0129785853341986 | I27: of:=[.H27]*[.$R$15] -> 0.604802076573654 | J27: of:=[.H27]*[.$R$16] -> 0.116807268007787 | L27: of:=MROUND([.I27];0.01) -> 0.6 | M27: of:=MROUND([.J27];0.01) -> 0.12
A28: 2022-05-02 | B28: KBDfans-CN | C28: Cherry Hyperglide MX RGB (Black) | D28: 1 | E28: of:=4/10 -> 0.4 | H28: of:=[.E28]/[.$E$87] -> 0.0129785853341986 | I28: of:=[.H28]*[.$R$15] -> 0.604802076573654 | J28: of:=[.H28]*[.$R$16] -> 0.116807268007787 | L28: of:=MROUND([.I28];0.01) -> 0.6 | M28: of:=MROUND([.J28];0.01) -> 0.12
A29: 2022-05-02 | B29: KBDfans-CN | C29: Cherry Hyperglide MX RGB (Brown) | D29: 1 | E29: of:=4/10 -> 0.4 | H29: of:=[.E29]/[.$E$87] -> 0.0129785853341986 | I29: of:=[.H29]*[.$R$15] -> 0.604802076573654 | J29: of:=[.H29]*[.$R$16] -> 0.116807268007787 | L29: of:=MROUND([.I29];0.01) -> 0.6 | M29: of:=MROUND([.J29];0.01) -> 0.12
A30: 2022-05-02 | B30: KBDfans-CN | C30: Cherry Hyperglide MX RGB (Blue) | D30: 1 | E30: of:=4/10 -> 0.4 | H30: of:=[.E30]/[.$E$87] -> 0.0129785853341986 | I30: of:=[.H30]*[.$R$15] -> 0.604802076573654 | J30: of:=[.H30]*[.$R$16] -> 0.116807268007787 | L30: of:=MROUND([.I30];0.01) -> 0.6 | M30: of:=MROUND([.J30];0.01) -> 0.12
A31: 2022-05-02 | B31: KBDfans-CN | C31: Cherry Hyperglide MX RGB (Speed Silver) | D31: 1 | E31: of:=5.5/10 -> 0.55 | H31: of:=[.E31]/[.$E$87] -> 0.017845554834523 | I31: of:=[.H31]*[.$R$15] -> 0.831602855288774 | J31: of:=[.H31]*[.$R$16] -> 0.160609993510707 | L31: of:=MROUND([.I31];0.01) -> 0.83 | M31: of:=MROUND([.J31];0.01) -> 0.16
A32: 2022-05-02 | B32: KBDfans-CN | C32: Gateron Aliaz (60g) | D32: 1 | E32: of:=8.5/10 -> 0.85 | H32: of:=[.E32]/[.$E$87] -> 0.027579493835172 | I32: of:=[.H32]*[.$R$15] -> 1.28520441271901 | J32: of:=[.H32]*[.$R$16] -> 0.248215444516548 | L32: of:=MROUND([.I32];0.01) -> 1.29 | M32: of:=MROUND([.J32];0.01) -> 0.25
A33: 2022-05-02 | B33: KBDfans-CN | C33: Gateron Aliaz (70g) | D33: 1 | E33: of:=8.5/10 -> 0.85 | H33: of:=[.E33]/[.$E$87] -> 0.027579493835172 | I33: of:=[.H33]*[.$R$15] -> 1.28520441271901 | J33: of:=[.H33]*[.$R$16] -> 0.248215444516548 | L33: of:=MROUND([.I33];0.01) -> 1.29 | M33: of:=MROUND([.J33];0.01) -> 0.25
A34: 2022-05-02 | B34: KBDfans-CN | C34: Gateron Aliaz (80g) | D34: 1 | E34: of:=8.5/10 -> 0.85 | H34: of:=[.E34]/[.$E$87] -> 0.027579493835172 | I34: of:=[.H34]*[.$R$15] -> 1.28520441271901 | J34: of:=[.H34]*[.$R$16] -> 0.248215444516548 | L34: of:=MROUND([.I34];0.01) -> 1.29 | M34: of:=MROUND([.J34];0.01) -> 0.25
A35: 2022-05-02 | B35: KBDfans-CN | C35: Gateron Aliaz (100g) | D35: 1 | E35: of:=8.5/10 -> 0.85 | H35: of:=[.E35]/[.$E$87] -> 0.027579493835172 | I35: of:=[.H35]*[.$R$15] -> 1.28520441271901 | J35: of:=[.H35]*[.$R$16] -> 0.248215444516548 | L35: of:=MROUND([.I35];0.01) -> 1.29 | M35: of:=MROUND([.J35];0.01) -> 0.25
A36: 2022-05-02 | B36: KBDfans-CN | C36: Gateron KS-8 (Clear) | D36: 1 | E36: of:=2/10 -> 0.2 | H36: of:=[.E36]/[.$E$87] -> 0.00648929266709929 | I36: of:=[.H36]*[.$R$15] -> 0.302401038286827 | J36: of:=[.H36]*[.$R$16] -> 0.0584036340038936 | L36: of:=MROUND([.I36];0.01) -> 0.3 | M36: of:=MROUND([.J36];0.01) -> 0.06
A37: 2022-05-02 | B37: KBDfans-CN | C37: Gateron KS-8 (Red) | D37: 1 | E37: of:=2/10 -> 0.2 | H37: of:=[.E37]/[.$E$87] -> 0.00648929266709929 | I37: of:=[.H37]*[.$R$15] -> 0.302401038286827 | J37: of:=[.H37]*[.$R$16] -> 0.0584036340038936 | L37: of:=MROUND([.I37];0.01) -> 0.3 | M37: of:=MROUND([.J37];0.01) -> 0.06
A38: 2022-05-02 | B38: KBDfans-CN | C38: Gateron KS-8 (Yellow) | D38: 1 | E38: of:=2/10 -> 0.2 | H38: of:=[.E38]/[.$E$87] -> 0.00648929266709929 | I38: of:=[.H38]*[.$R$15] -> 0.302401038286827 | J38: of:=[.H38]*[.$R$16] -> 0.0584036340038936 | L38: of:=MROUND([.I38];0.01) -> 0.3 | M38: of:=MROUND([.J38];0.01) -> 0.06
A39: 2022-05-02 | B39: KBDfans-CN | C39: Gateron KS-8 (Black) | D39: 1 | E39: of:=2/10 -> 0.2 | H39: of:=[.E39]/[.$E$87] -> 0.00648929266709929 | I39: of:=[.H39]*[.$R$15] -> 0.302401038286827 | J39: of:=[.H39]*[.$R$16] -> 0.0584036340038936 | L39: of:=MROUND([.I39];0.01) -> 0.3 | M39: of:=MROUND([.J39];0.01) -> 0.06
A40: 2022-05-02 | B40: KBDfans-CN | C40: Gateron KS-8 (Brown) | D40: 1 | E40: of:=2/10 -> 0.2 | H40: of:=[.E40]/[.$E$87] -> 0.00648929266709929 | I40: of:=[.H40]*[.$R$15] -> 0.302401038286827 | J40: of:=[.H40]*[.$R$16] -> 0.0584036340038936 | L40: of:=MROUND([.I40];0.01) -> 0.3 | M40: of:=MROUND([.J40];0.01) -> 0.06
A41: 2022-05-02 | B41: KBDfans-CN | C41: Gateron KS-8 (Blue) | D41: 1 | E41: of:=2/10 -> 0.2 | H41: of:=[.E41]/[.$E$87] -> 0.00648929266709929 | I41: of:=[.H41]*[.$R$15] -> 0.302401038286827 | J41: of:=[.H41]*[.$R$16] -> 0.0584036340038936 | L41: of:=MROUND([.I41];0.01) -> 0.3 | M41: of:=MROUND([.J41];0.01) -> 0.06
A42: 2022-05-02 | B42: KBDfans-CN | C42: Gateron KS-8 (Green) | D42: 1 | E42: of:=2/10 -> 0.2 | H42: of:=[.E42]/[.$E$87] -> 0.00648929266709929 | I42: of:=[.H42]*[.$R$15] -> 0.302401038286827 | J42: of:=[.H42]*[.$R$16] -> 0.0584036340038936 | L42: of:=MROUND([.I42];0.01) -> 0.3 | M42: of:=MROUND([.J42];0.01) -> 0.06
A43: 2022-05-02 | B43: KBDfans-CN | C43: Gateron KS-9 (Clear) | D43: 1 | E43: of:=2/10 -> 0.2 | H43: of:=[.E43]/[.$E$87] -> 0.00648929266709929 | I43: of:=[.H43]*[.$R$15] -> 0.302401038286827 | J43: of:=[.H43]*[.$R$16] -> 0.0584036340038936 | L43: of:=MROUND([.I43];0.01) -> 0.3 | M43: of:=MROUND([.J43];0.01) -> 0.06
A44: 2022-05-02 | B44: KBDfans-CN | C44: Gateron KS-9 (Red) | D44: 1 | E44: of:=2/10 -> 0.2 | H44: of:=[.E44]/[.$E$87] -> 0.00648929266709929 | I44: of:=[.H44]*[.$R$15] -> 0.302401038286827 | J44: of:=[.H44]*[.$R$16] -> 0.0584036340038936 | L44: of:=MROUND([.I44];0.01) -> 0.3 | M44: of:=MROUND([.J44];0.01) -> 0.06
A45: 2022-05-02 | B45: KBDfans-CN | C45: Gateron KS-9 (Yellow) | D45: 1 | E45: of:=2/10 -> 0.2 | H45: of:=[.E45]/[.$E$87] -> 0.00648929266709929 | I45: of:=[.H45]*[.$R$15] -> 0.302401038286827 | J45: of:=[.H45]*[.$R$16] -> 0.0584036340038936 | L45: of:=MROUND([.I45];0.01) -> 0.3 | M45: of:=MROUND([.J45];0.01) -> 0.06
A46: 2022-05-02 | B46: KBDfans-CN | C46: Gateron KS-9 (Black) | D46: 1 | E46: of:=2/10 -> 0.2 | H46: of:=[.E46]/[.$E$87] -> 0.00648929266709929 | I46: of:=[.H46]*[.$R$15] -> 0.302401038286827 | J46: of:=[.H46]*[.$R$16] -> 0.0584036340038936 | L46: of:=MROUND([.I46];0.01) -> 0.3 | M46: of:=MROUND([.J46];0.01) -> 0.06
A47: 2022-05-02 | B47: KBDfans-CN | C47: Gateron KS-9 (Brown) | D47: 1 | E47: of:=2/10 -> 0.2 | H47: of:=[.E47]/[.$E$87] -> 0.00648929266709929 | I47: of:=[.H47]*[.$R$15] -> 0.302401038286827 | J47: of:=[.H47]*[.$R$16] -> 0.0584036340038936 | L47: of:=MROUND([.I47];0.01) -> 0.3 | M47: of:=MROUND([.J47];0.01) -> 0.06
A48: 2022-05-02 | B48: KBDfans-CN | C48: Gateron KS-9 (Blue) | D48: 1 | E48: of:=2/10 -> 0.2 | H48: of:=[.E48]/[.$E$87] -> 0.00648929266709929 | I48: of:=[.H48]*[.$R$15] -> 0.302401038286827 | J48: of:=[.H48]*[.$R$16] -> 0.0584036340038936 | L48: of:=MROUND([.I48];0.01) -> 0.3 | M48: of:=MROUND([.J48];0.01) -> 0.06
A49: 2022-05-02 | B49: KBDfans-CN | C49: Gateron KS-9 (Green) | D49: 1 | E49: of:=2/10 -> 0.2 | H49: of:=[.E49]/[.$E$87] -> 0.00648929266709929 | I49: of:=[.H49]*[.$R$15] -> 0.302401038286827 | J49: of:=[.H49]*[.$R$16] -> 0.0584036340038936 | L49: of:=MROUND([.I49];0.01) -> 0.3 | M49: of:=MROUND([.J49];0.01) -> 0.06
A50: 2022-05-02 | B50: KBDfans-CN | C50: Gateron KS-3 (Clear) | D50: 1 | E50: of:=2.5/10 -> 0.25 | H50: of:=[.E50]/[.$E$87] -> 0.00811161583387411 | I50: of:=[.H50]*[.$R$15] -> 0.378001297858533 | J50: of:=[.H50]*[.$R$16] -> 0.073004542504867 | L50: of:=MROUND([.I50];0.01) -> 0.38 | M50: of:=MROUND([.J50];0.01) -> 0.07
A51: 2022-05-02 | B51: KBDfans-CN | C51: Gateron KS-3 (Red) | D51: 1 | E51: of:=2.5/10 -> 0.25 | H51: of:=[.E51]/[.$E$87] -> 0.00811161583387411 | I51: of:=[.H51]*[.$R$15] -> 0.378001297858533 | J51: of:=[.H51]*[.$R$16] -> 0.073004542504867 | L51: of:=MROUND([.I51];0.01) -> 0.38 | M51: of:=MROUND([.J51];0.01) -> 0.07
A52: 2022-05-02 | B52: KBDfans-CN | C52: Gateron KS-3 (Yellow) | D52: 1 | E52: of:=2.5/10 -> 0.25 | H52: of:=[.E52]/[.$E$87] -> 0.00811161583387411 | I52: of:=[.H52]*[.$R$15] -> 0.378001297858533 | J52: of:=[.H52]*[.$R$16] -> 0.073004542504867 | L52: of:=MROUND([.I52];0.01) -> 0.38 | M52: of:=MROUND([.J52];0.01) -> 0.07
A53: 2022-05-02 | B53: KBDfans-CN | C53: Gateron KS-3 (Black) | D53: 1 | E53: of:=2.5/10 -> 0.25 | H53: of:=[.E53]/[.$E$87] -> 0.00811161583387411 | I53: of:=[.H53]*[.$R$15] -> 0.378001297858533 | J53: of:=[.H53]*[.$R$16] -> 0.073004542504867 | L53: of:=MROUND([.I53];0.01) -> 0.38 | M53: of:=MROUND([.J53];0.01) -> 0.07
A54: 2022-05-02 | B54: KBDfans-CN | C54: Gateron KS-3 (Brown) | D54: 1 | E54: of:=2.4/10 -> 0.24 | H54: of:=[.E54]/[.$E$87] -> 0.00778715120051914 | I54: of:=[.H54]*[.$R$15] -> 0.362881245944192 | J54: of:=[.H54]*[.$R$16] -> 0.0700843608046723 | L54: of:=MROUND([.I54];0.01)+0.01 -> 0.37 | M54: of:=MROUND([.J54];0.01) -> 0.07
A55: 2022-05-02 | B55: KBDfans-CN | C55: Gateron KS-3 (Blue) | D55: 1 | E55: of:=2.5/10 -> 0.25 | H55: of:=[.E55]/[.$E$87] -> 0.00811161583387411 | I55: of:=[.H55]*[.$R$15] -> 0.378001297858533 | J55: of:=[.H55]*[.$R$16] -> 0.073004542504867 | L55: of:=MROUND([.I55];0.01) -> 0.38 | M55: of:=MROUND([.J55];0.01) -> 0.07
A56: 2022-05-02 | B56: KBDfans-CN | C56: Gateron KS-3 (Green) | D56: 1 | E56: of:=2.5/10 -> 0.25 | H56: of:=[.E56]/[.$E$87] -> 0.00811161583387411 | I56: of:=[.H56]*[.$R$15] -> 0.378001297858533 | J56: of:=[.H56]*[.$R$16] -> 0.073004542504867 | L56: of:=MROUND([.I56];0.01) -> 0.38 | M56: of:=MROUND([.J56];0.01) -> 0.07
A57: 2022-05-02 | B57: KBDfans-CN | C57: Gateron Silent (Red) | D57: 1 | E57: of:=3.8/10 -> 0.38 | H57: of:=[.E57]/[.$E$87] -> 0.0123296560674886 | I57: of:=[.H57]*[.$R$15] -> 0.574561972744971 | J57: of:=[.H57]*[.$R$16] -> 0.110966904607398 | L57: of:=MROUND([.I57];0.01) -> 0.57 | M57: of:=MROUND([.J57];0.01) -> 0.11
A58: 2022-05-02 | B58: KBDfans-CN | C58: Gateron Silent (Black) | D58: 1 | E58: of:=3.8/10 -> 0.38 | H58: of:=[.E58]/[.$E$87] -> 0.0123296560674886 | I58: of:=[.H58]*[.$R$15] -> 0.574561972744971 | J58: of:=[.H58]*[.$R$16] -> 0.110966904607398 | L58: of:=MROUND([.I58];0.01) -> 0.57 | M58: of:=MROUND([.J58];0.01) -> 0.11
A59: 2022-05-02 | B59: KBDfans-CN | C59: Gateron Silent (Brown) | D59: 1 | E59: of:=3.8/10 -> 0.38 | H59: of:=[.E59]/[.$E$87] -> 0.0123296560674886 | I59: of:=[.H59]*[.$R$15] -> 0.574561972744971 | J59: of:=[.H59]*[.$R$16] -> 0.110966904607398 | L59: of:=MROUND([.I59];0.01) -> 0.57 | M59: of:=MROUND([.J59];0.01) -> 0.11
A60: 2022-05-02 | B60: KBDfans-CN | C60: Kailh Box (Red) | D60: 1 | E60: of:=3.8/10 -> 0.38 | H60: of:=[.E60]/[.$E$87] -> 0.0123296560674886 | I60: of:=[.H60]*[.$R$15] -> 0.574561972744971 | J60: of:=[.H60]*[.$R$16] -> 0.110966904607398 | L60: of:=MROUND([.I60];0.01) -> 0.57 | M60: of:=MROUND([.J60];0.01) -> 0.11
A61: 2022-05-02 | B61: KBDfans-CN | C61: Kailh Box (Black) | D61: 1 | E61: of:=3.8/10 -> 0.38 | H61: of:=[.E61]/[.$E$87] -> 0.0123296560674886 | I61: of:=[.H61]*[.$R$15] -> 0.574561972744971 | J61: of:=[.H61]*[.$R$16] -> 0.110966904607398 | L61: of:=MROUND([.I61];0.01) -> 0.57 | M61: of:=MROUND([.J61];0.01) -> 0.11
A62: 2022-05-02 | B62: KBDfans-CN | C62: Kailh Box (Brown) | D62: 1 | E62: of:=3.8/10 -> 0.38 | H62: of:=[.E62]/[.$E$87] -> 0.0123296560674886 | I62: of:=[.H62]*[.$R$15] -> 0.574561972744971 | J62: of:=[.H62]*[.$R$16] -> 0.110966904607398 | L62: of:=MROUND([.I62];0.01) -> 0.57 | M62: of:=MROUND([.J62];0.01) -> 0.11
A63: 2022-05-02 | B63: KBDfans-CN | C63: Kailh Box (White) | D63: 1 | E63: of:=3.8/10 -> 0.38 | H63: of:=[.E63]/[.$E$87] -> 0.0123296560674886 | I63: of:=[.H63]*[.$R$15] -> 0.574561972744971 | J63: of:=[.H63]*[.$R$16] -> 0.110966904607398 | L63: of:=MROUND([.I63];0.01) -> 0.57 | M63: of:=MROUND([.J63];0.01) -> 0.11
A64: 2022-05-02 | B64: KBDfans-CN | C64: Kailh Box (Royal) | D64: 1 | E64: of:=5/10 -> 0.5 | H64: of:=[.E64]/[.$E$87] -> 0.0162232316677482 | I64: of:=[.H64]*[.$R$15] -> 0.756002595717067 | J64: of:=[.H64]*[.$R$16] -> 0.146009085009734 | L64: of:=MROUND([.I64];0.01) -> 0.76 | M64: of:=MROUND([.J64];0.01) -> 0.15
A65: 2022-05-02 | B65: KBDfans-CN | C65: Kailh Box Hako (True) | D65: 1 | E65: of:=5/10 -> 0.5 | H65: of:=[.E65]/[.$E$87] -> 0.0162232316677482 | I65: of:=[.H65]*[.$R$15] -> 0.756002595717067 | J65: of:=[.H65]*[.$R$16] -> 0.146009085009734 | L65: of:=MROUND([.I65];0.01) -> 0.76 | M65: of:=MROUND([.J65];0.01) -> 0.15
A66: 2022-05-02 | B66: KBDfans-CN | C66: Kailh Box Hako (Violet) | D66: 1 | E66: of:=5/10 -> 0.5 | H66: of:=[.E66]/[.$E$87] -> 0.0162232316677482 | I66: of:=[.H66]*[.$R$15] -> 0.756002595717067 | J66: of:=[.H66]*[.$R$16] -> 0.146009085009734 | L66: of:=MROUND([.I66];0.01) -> 0.76 | M66: of:=MROUND([.J66];0.01) -> 0.15
A67: 2022-05-02 | B67: KBDfans-CN | C67: Kailh Box Hako (Clear) | D67: 1 | E67: of:=16.5/30 -> 0.55 | H67: of:=[.E67]/[.$E$87] -> 0.017845554834523 | I67: of:=[.H67]*[.$R$15] -> 0.831602855288774 | J67: of:=[.H67]*[.$R$16] -> 0.160609993510707 | L67: of:=MROUND([.I67];0.01) -> 0.83 | M67: of:=MROUND([.J67];0.01) -> 0.16
A68: 2022-05-02 | B68: KBDfans-CN | C68: Kailh Box Hako (Royal Clear) | D68: 1 | E68: of:=16.5/30 -> 0.55 | H68: of:=[.E68]/[.$E$87] -> 0.017845554834523 | I68: of:=[.H68]*[.$R$15] -> 0.831602855288774 | J68: of:=[.H68]*[.$R$16] -> 0.160609993510707 | L68: of:=MROUND([.I68];0.01) -> 0.83 | M68: of:=MROUND([.J68];0.01) -> 0.16
A69: 2022-05-02 | B69: KBDfans-CN | C69: Kailh Pro (Burgundy) | D69: 1 | E69: of:=3/10 -> 0.3 | H69: of:=[.E69]/[.$E$87] -> 0.00973393900064893 | I69: of:=[.H69]*[.$R$15] -> 0.45360155743024 | J69: of:=[.H69]*[.$R$16] -> 0.0876054510058404 | L69: of:=MROUND([.I69];0.01) -> 0.45 | M69: of:=MROUND([.J69];0.01) -> 0.09
A70: 2022-05-02 | B70: KBDfans-CN | C70: Kailh Pro (Purple) | D70: 1 | E70: of:=9/30 -> 0.3 | H70: of:=[.E70]/[.$E$87] -> 0.00973393900064893 | I70: of:=[.H70]*[.$R$15] -> 0.45360155743024 | J70: of:=[.H70]*[.$R$16] -> 0.0876054510058404 | L70: of:=MROUND([.I70];0.01) -> 0.45 | M70: of:=MROUND([.J70];0.01) -> 0.09
A71: 2022-05-02 | B71: KBDfans-CN | C71: Kailh Pro (Light Green) | D71: 1 | E71: of:=3/10 -> 0.3 | H71: of:=[.E71]/[.$E$87] -> 0.00973393900064893 | I71: of:=[.H71]*[.$R$15] -> 0.45360155743024 | J71: of:=[.H71]*[.$R$16] -> 0.0876054510058404 | L71: of:=MROUND([.I71];0.01) -> 0.45 | M71: of:=MROUND([.J71];0.01) -> 0.09
A72: 2022-05-02 | B72: KBDfans-CN | C72: Kailh Speed (Silver) | D72: 1 | E72: of:=2.8/10 -> 0.28 | H72: of:=[.E72]/[.$E$87] -> 0.009085009733939 | I72: of:=[.H72]*[.$R$15] -> 0.423361453601557 | J72: of:=[.H72]*[.$R$16] -> 0.081765087605451 | L72: of:=MROUND([.I72];0.01) -> 0.42 | M72: of:=MROUND([.J72];0.01) -> 0.08
A73: 2022-05-02 | B73: KBDfans-CN | C73: Kailh Speed (Copper) | D73: 1 | E73: of:=2.8/10 -> 0.28 | H73: of:=[.E73]/[.$E$87] -> 0.009085009733939 | I73: of:=[.H73]*[.$R$15] -> 0.423361453601557 | J73: of:=[.H73]*[.$R$16] -> 0.081765087605451 | L73: of:=MROUND([.I73];0.01) -> 0.42 | M73: of:=MROUND([.J73];0.01) -> 0.08
A74: 2022-05-02 | B74: KBDfans-CN | C74: Kailh Speed (Gold) | D74: 1 | E74: of:=2.8/10 -> 0.28 | H74: of:=[.E74]/[.$E$87] -> 0.009085009733939 | I74: of:=[.H74]*[.$R$15] -> 0.423361453601557 | J74: of:=[.H74]*[.$R$16] -> 0.081765087605451 | L74: of:=MROUND([.I74];0.01) -> 0.42 | M74: of:=MROUND([.J74];0.01) -> 0.08
A75: 2022-05-02 | B75: KBDfans-CN | C75: Kailh Speed (Bronze) | D75: 1 | E75: of:=2.8/10 -> 0.28 | H75: of:=[.E75]/[.$E$87] -> 0.009085009733939 | I75: of:=[.H75]*[.$R$15] -> 0.423361453601557 | J75: of:=[.H75]*[.$R$16] -> 0.081765087605451 | L75: of:=MROUND([.I75];0.01) -> 0.42 | M75: of:=MROUND([.J75];0.01) -> 0.08
A76: 2022-05-02 | B76: KBDfans-CN | C76: NovelKeys x Kailh Cream | D76: 1 | E76: of:=6.5/10 -> 0.65 | H76: of:=[.E76]/[.$E$87] -> 0.0210902011680727 | I76: of:=[.H76]*[.$R$15] -> 0.982803374432187 | J76: of:=[.H76]*[.$R$16] -> 0.189811810512654 | L76: of:=MROUND([.I76];0.01)+0.01 -> 0.99 | M76: of:=MROUND([.J76];0.01) -> 0.19
A77: 2022-05-02 | B77: KBDfans-CN | C77: NovelKeys x Kailh Box (Dark Yellow) | D77: 1 | E77: of:=4.5/10 -> 0.45 | H77: of:=[.E77]/[.$E$87] -> 0.0146009085009734 | I77: of:=[.H77]*[.$R$15] -> 0.68040233614536 | J77: of:=[.H77]*[.$R$16] -> 0.131408176508761 | L77: of:=MROUND([.I77];0.01) -> 0.68 | M77: of:=MROUND([.J77];0.01) -> 0.13
A78: 2022-05-02 | B78: KBDfans-CN | C78: NovelKeys x Kailh Box (Burnt Orange) | D78: 1 | E78: of:=4.5/10 -> 0.45 | H78: of:=[.E78]/[.$E$87] -> 0.0146009085009734 | I78: of:=[.H78]*[.$R$15] -> 0.68040233614536 | J78: of:=[.H78]*[.$R$16] -> 0.131408176508761 | L78: of:=MROUND([.I78];0.01) -> 0.68 | M78: of:=MROUND([.J78];0.01) -> 0.13
A79: 2022-05-02 | B79: KBDfans-CN | C79: NovelKeys x Kailh Box (Pale Blue) | D79: 1 | E79: of:=4.5/10 -> 0.45 | H79: of:=[.E79]/[.$E$87] -> 0.0146009085009734 | I79: of:=[.H79]*[.$R$15] -> 0.68040233614536 | J79: of:=[.H79]*[.$R$16] -> 0.131408176508761 | L79: of:=MROUND([.I79];0.01) -> 0.68 | M79: of:=MROUND([.J79];0.01) -> 0.13
A80: 2022-05-02 | B80: KBDfans-CN | C80: NovelKeys x Kailh Box (Navy) | D80: 1 | E80: of:=4.2/10 -> 0.42 | H80: of:=[.E80]/[.$E$87] -> 0.0136275146009085 | I80: of:=[.H80]*[.$R$15] -> 0.635042180402336 | J80: of:=[.H80]*[.$R$16] -> 0.122647631408177 | L80: of:=MROUND([.I80];0.01) -> 0.64 | M80: of:=MROUND([.J80];0.01) -> 0.12
A81: 2022-05-02 | B81: KBDfans-CN | C81: NovelKeys x Kailh Box (Jade) | D81: 1 | E81: of:=4.2/10 -> 0.42 | H81: of:=[.E81]/[.$E$87] -> 0.0136275146009085 | I81: of:=[.H81]*[.$R$15] -> 0.635042180402336 | J81: of:=[.H81]*[.$R$16] -> 0.122647631408177 | L81: of:=MROUND([.I81];0.01) -> 0.64 | M81: of:=MROUND([.J81];0.01) -> 0.12
A82: 2022-05-02 | B82: KBDfans-CN | C82: Zeal Tealio V2 (67g) | D82: 1 | E82: of:=11/10 -> 1.1 | H82: of:=[.E82]/[.$E$87] -> 0.0356911096690461 | I82: of:=[.H82]*[.$R$15] -> 1.66320571057755 | J82: of:=[.H82]*[.$R$16] -> 0.321219987021415 | L82: of:=MROUND([.I82];0.01) -> 1.66 | M82: of:=MROUND([.J82];0.01) -> 0.32
A83: 2022-05-02 | B83: KBDfans-CN | C83: Zeal Zealio V2 (62g) | D83: 1 | E83: of:=11/10 -> 1.1 | H83: of:=[.E83]/[.$E$87] -> 0.0356911096690461 | I83: of:=[.H83]*[.$R$15] -> 1.66320571057755 | J83: of:=[.H83]*[.$R$16] -> 0.321219987021415 | L83: of:=MROUND([.I83];0.01) -> 1.66 | M83: of:=MROUND([.J83];0.01) -> 0.32
A84: 2022-05-02 | B84: KBDfans-CN | C84: Zeal Zealio V2 (65g) | D84: 1 | E84: of:=11/10 -> 1.1 | H84: of:=[.E84]/[.$E$87] -> 0.0356911096690461 | I84: of:=[.H84]*[.$R$15] -> 1.66320571057755 | J84: of:=[.H84]*[.$R$16] -> 0.321219987021415 | L84: of:=MROUND([.I84];0.01) -> 1.66 | M84: of:=MROUND([.J84];0.01) -> 0.32
A85: 2022-05-02 | B85: KBDfans-CN | C85: Zeal Zealio V2 (67g) | D85: 1 | E85: of:=11/10 -> 1.1 | H85: of:=[.E85]/[.$E$87] -> 0.0356911096690461 | I85: of:=[.H85]*[.$R$15] -> 1.66320571057755 | J85: of:=[.H85]*[.$R$16] -> 0.321219987021415 | L85: of:=MROUND([.I85];0.01) -> 1.66 | M85: of:=MROUND([.J85];0.01) -> 0.32
A86: 2022-05-02 | B86: KBDfans-CN | C86: Zeal Zealio V2 (78g) | D86: 1 | E86: of:=11/10 -> 1.1 | H86: of:=[.E86]/[.$E$87] -> 0.0356911096690461 | I86: of:=[.H86]*[.$R$15] -> 1.66320571057755 | J86: of:=[.H86]*[.$R$16] -> 0.321219987021415 | L86: of:=MROUND([.I86];0.01) -> 1.66 | M86: of:=MROUND([.J86];0.01) -> 0.32
C87: (TOTAL) | D87: of:=SUM([.D15:.D86]) -> 72 | E87: of:=SUM([.E15:.E86]) -> 30.82 | H87: of:=SUM([.H15:.H86]) -> 1 | I87: of:=SUM([.I15:.I86]) -> 46.6 | J87: of:=SUM([.J15:.J86]) -> 9 | L87: of:=SUM([.L15:.L86]) -> 46.6 | M87: of:=SUM([.M15:.M86]) -> 9.00000000000001
A89: 2022-05-15 | B89: INEDA-CN | C89: Outemu (Red) | D89: 1 | E89: of:=6.9/10 -> 0.69 | H89: of:=[.E89]/[.$E$107] -> 0.050061670173402 | I89: of:=[.H89]*[.$R$89] -> 0.617761009939781 | J89: of:=[.H89]*[.$R$90] -> 0.0640789378219546 | L89: of:=MROUND([.I89];0.01) -> 0.62 | M89: of:=MROUND([.J89];0.01) -> 0.06 | Q89: Actual Total Item Cost (AUD) | R89: 12.34
A90: 2022-05-15 | B90: INEDA-CN | C90: Outemu (Black) | D90: 1 | E90: of:=6.9/10 -> 0.69 | H90: of:=[.E90]/[.$E$107] -> 0.050061670173402 | I90: of:=[.H90]*[.$R$89] -> 0.617761009939781 | J90: of:=[.H90]*[.$R$90] -> 0.0640789378219546 | L90: of:=MROUND([.I90];0.01) -> 0.62 | M90: of:=MROUND([.J90];0.01) -> 0.06 | Q90: Actual Shipping Cost (AUD) | R90: 1.28
A91: 2022-05-15 | B91: INEDA-CN | C91: Outemu (Brown) | D91: 1 | E91: of:=6.9/10 -> 0.69 | H91: of:=[.E91]/[.$E$107] -> 0.050061670173402 | I91: of:=[.H91]*[.$R$89] -> 0.617761009939781 | J91: of:=[.H91]*[.$R$90] -> 0.0640789378219546 | L91: of:=MROUND([.I91];0.01) -> 0.62 | M91: of:=MROUND([.J91];0.01) -> 0.06
A92: 2022-05-15 | B92: INEDA-CN | C92: Outemu (Blue) | D92: 1 | E92: of:=6.9/10 -> 0.69 | H92: of:=[.E92]/[.$E$107] -> 0.050061670173402 | I92: of:=[.H92]*[.$R$89] -> 0.617761009939781 | J92: of:=[.H92]*[.$R$90] -> 0.0640789378219546 | L92: of:=MROUND([.I92];0.01) -> 0.62 | M92: of:=MROUND([.J92];0.01) -> 0.06
A93: 2022-05-15 | B93: INEDA-CN | C93: Outemu (Teal) | D93: 1 | E93: of:=6.9/10 -> 0.69 | H93: of:=[.E93]/[.$E$107] -> 0.050061670173402 | I93: of:=[.H93]*[.$R$89] -> 0.617761009939781 | J93: of:=[.H93]*[.$R$90] -> 0.0640789378219546 | L93: of:=MROUND([.I93];0.01) -> 0.62 | M93: of:=MROUND([.J93];0.01) -> 0.06
A94: 2022-05-15 | B94: INEDA-CN | C94: Outemu (Purple) | D94: 1 | E94: of:=6.9/10 -> 0.69 | H94: of:=[.E94]/[.$E$107] -> 0.050061670173402 | I94: of:=[.H94]*[.$R$89] -> 0.617761009939781 | J94: of:=[.H94]*[.$R$90] -> 0.0640789378219546 | L94: of:=MROUND([.I94];0.01) -> 0.62 | M94: of:=MROUND([.J94];0.01) -> 0.06
A95: 2022-05-15 | B95: INEDA-CN | C95: Outemu (Orange) | D95: 1 | E95: of:=6.9/10 -> 0.69 | H95: of:=[.E95]/[.$E$107] -> 0.050061670173402 | I95: of:=[.H95]*[.$R$89] -> 0.617761009939781 | J95: of:=[.H95]*[.$R$90] -> 0.0640789378219546 | L95: of:=MROUND([.I95];0.01) -> 0.62 | M95: of:=MROUND([.J95];0.01) -> 0.06
A96: 2022-05-15 | B96: INEDA-CN | C96: Outemu (Gold) | D96: 1 | E96: of:=6.9/10 -> 0.69 | H96: of:=[.E96]/[.$E$107] -> 0.050061670173402 | I96: of:=[.H96]*[.$R$89] -> 0.617761009939781 | J96: of:=[.H96]*[.$R$90] -> 0.0640789378219546 | L96: of:=MROUND([.I96];0.01) -> 0.62 | M96: of:=MROUND([.J96];0.01) -> 0.06
A97: 2022-05-15 | B97: INEDA-CN | C97: Outemu (Silver) | D97: 1 | E97: of:=6.9/10 -> 0.69 | H97: of:=[.E97]/[.$E$107] -> 0.050061670173402 | I97: of:=[.H97]*[.$R$89] -> 0.617761009939781 | J97: of:=[.H97]*[.$R$90] -> 0.0640789378219546 | L97: of:=MROUND([.I97];0.01) -> 0.62 | M97: of:=MROUND([.J97];0.01) -> 0.06
A98: 2022-05-15 | B98: INEDA-CN | C98: Outemu (Silent Gray) | D98: 1 | E98: of:=8.22/10 -> 0.822 | H98: of:=[.E98]/[.$E$107] -> 0.0596386853370094 | I98: of:=[.H98]*[.$R$89] -> 0.735941377058696 | J98: of:=[.H98]*[.$R$90] -> 0.076337517231372 | L98: of:=MROUND([.I98];0.01) -> 0.74 | M98: of:=MROUND([.J98];0.01) -> 0.08
A99: 2022-05-15 | B99: INEDA-CN | C99: Outemu (Silent White) | D99: 1 | E99: of:=8.22/10 -> 0.822 | H99: of:=[.E99]/[.$E$107] -> 0.0596386853370094 | I99: of:=[.H99]*[.$R$89] -> 0.735941377058696 | J99: of:=[.H99]*[.$R$90] -> 0.076337517231372 | L99: of:=MROUND([.I99];0.01) -> 0.74 | M99: of:=MROUND([.J99];0.01) -> 0.08
A100: 2022-05-15 | B100: INEDA-CN | C100: Outemu (Lime) | D100: 1 | E100: of:=8.47/10 -> 0.847 | H100: of:=[.E100]/[.$E$107] -> 0.0614525139664805 | I100: of:=[.H100]*[.$R$89] -> 0.758324022346369 | J100: of:=[.H100]*[.$R$90] -> 0.078659217877095 | L100: of:=MROUND([.I100];0.01) -> 0.76 | M100: of:=MROUND([.J100];0.01)+0.01 -> 0.09
A101: 2022-05-15 | B101: INEDA-CN | C101: Outemu (Honey Peach) | D101: 1 | E101: of:=8.47/10 -> 0.847 | H101: of:=[.E101]/[.$E$107] -> 0.0614525139664805 | I101: of:=[.H101]*[.$R$89] -> 0.758324022346369 | J101: of:=[.H101]*[.$R$90] -> 0.078659217877095 | L101: of:=MROUND([.I101];0.01) -> 0.76 | M101: of:=MROUND([.J101];0.01)+0.01 -> 0.09
A102: 2022-05-15 | B102: INEDA-CN | C102: Outemu (Red Panda) | D102: 1 | E102: of:=8.47/10 -> 0.847 | H102: of:=[.E102]/[.$E$107] -> 0.0614525139664805 | I102: of:=[.H102]*[.$R$89] -> 0.758324022346369 | J102: of:=[.H102]*[.$R$90] -> 0.078659217877095 | L102: of:=MROUND([.I102];0.01) -> 0.76 | M102: of:=MROUND([.J102];0.01) -> 0.08
A103: 2022-05-15 | B103: INEDA-CN | C103: Outemu (Crystal) | D103: 1 | E103: of:=8.47/10 -> 0.847 | H103: of:=[.E103]/[.$E$107] -> 0.0614525139664805 | I103: of:=[.H103]*[.$R$89] -> 0.758324022346369 | J103: of:=[.H103]*[.$R$90] -> 0.078659217877095 | L103: of:=MROUND([.I103];0.01)-0.01 -> 0.75 | M103: of:=MROUND([.J103];0.01) -> 0.08
A104: 2022-05-15 | B104: INEDA-CN | C104: Outemu (Yellow Silver) | D104: 1 | E104: of:=8.47/10 -> 0.847 | H104: of:=[.E104]/[.$E$107] -> 0.0614525139664805 | I104: of:=[.H104]*[.$R$89] -> 0.758324022346369 | J104: of:=[.H104]*[.$R$90] -> 0.078659217877095 | L104: of:=MROUND([.I104];0.01)-0.01 -> 0.75 | M104: of:=MROUND([.J104];0.01) -> 0.08
A105: 2022-05-15 | B105: INEDA-CN | C105: Outemu (Ocean Clicky) | D105: 1 | E105: of:=8.47/10 -> 0.847 | H105: of:=[.E105]/[.$E$107] -> 0.0614525139664805 | I105: of:=[.H105]*[.$R$89] -> 0.758324022346369 | J105: of:=[.H105]*[.$R$90] -> 0.078659217877095 | L105: of:=MROUND([.I105];0.01)-0.01 -> 0.75 | M105: of:=MROUND([.J105];0.01) -> 0.08
A106: 2022-05-15 | B106: INEDA-CN | C106: Outemu (Ocean Linear) | D106: 1 | E106: of:=8.47/10 -> 0.847 | H106: of:=[.E106]/[.$E$107] -> 0.0614525139664805 | I106: of:=[.H106]*[.$R$89] -> 0.758324022346369 | J106: of:=[.H106]*[.$R$90] -> 0.078659217877095 | L106: of:=MROUND([.I106];0.01)-0.01 -> 0.75 | M106: of:=MROUND([.J106];0.01) -> 0.08
C107: (TOTAL) | D107: of:=SUM([.D89:.D106]) -> 18 | E107: of:=SUM([.E89:.E106]) -> 13.783 | H107: of:=SUM([.H89:.H106]) -> 1 | I107: of:=SUM([.I89:.I106]) -> 12.34 | J107: of:=SUM([.J89:.J106]) -> 1.28 | L107: of:=SUM([.L89:.L106]) -> 12.34 | M107: of:=SUM([.M89:.M106]) -> 1.28
A109: 2022-05-11 | B109: HippoKeys-US | C109: C³Equalz X TKC Dragon Fruit | D109: 1 | E109: of:=6.35/10 -> 0.635 | F109: Not sold. Guessed using other C3Equalz listings. | H109: of:=[.E109]/[.$E$141] -> 0.0316489869832119 | I109: of:=[.H109]*[.$R$109] -> 1.44287731656463 | J109: of:=[.H109]*[.$R$110] -> 1.3814782818172 | L109: of:=MROUND([.I109];0.01) -> 1.44 | M109: of:=MROUND([.J109];0.01) -> 1.38 | N109: of:=MROUND( ([.I109]-[.L109])*10000 ;0.01) -> 28.77 | O109: of:=MROUND( ([.J109]-[.M109])*10000 ;0.01) -> 14.78 | Q109: Actual Total Item Cost (AUD) | R109: 45.59
A110: 2022-05-11 | B110: HippoKeys-US | C110: Candy Jade Green (62g) | D110: 1 | E110: of:=75.9/110 -> 0.69 | F110: Not sold. Guessed using Divinikey 110-piece price. | H110: of:=[.E110]/[.$E$141] -> 0.0343902378242775 | I110: of:=[.H110]*[.$R$109] -> 1.56785094240881 | J110: of:=[.H110]*[.$R$110] -> 1.50113388102971 | L110: of:=MROUND([.I110];0.01) -> 1.57 | M110: of:=MROUND([.J110];0.01) -> 1.5 | N110: of:=MROUND( ([.I110]-[.L110])*10000 ;0.01) -> -21.49 | O110: of:=MROUND( ([.J110]-[.M110])*10000 ;0.01) -> 11.34 | Q110: Actual Shipping Cost (AUD) | R110: 43.65
A111: 2022-05-11 | B111: HippoKeys-US | C111: Durock T1 | D111: 1 | E111: of:=5.6/10 -> 0.56 | H111: of:=[.E111]/[.$E$141] -> 0.0279109176544861 | I111: of:=[.H111]*[.$R$109] -> 1.27245873586802 | J111: of:=[.H111]*[.$R$110] -> 1.21831155561832 | L111: of:=MROUND([.I111];0.01) -> 1.27 | M111: of:=MROUND([.J111];0.01) -> 1.22 | N111: of:=MROUND( ([.I111]-[.L111])*10000 ;0.01) -> 24.59 | O111: of:=MROUND( ([.J111]-[.M111])*10000 ;0.01) -> -16.88
A112: 2022-05-11 | B112: HippoKeys-US | C112: Everglide Aqua King | D112: 1 | E112: of:=8.8/10 -> 0.88 | F112: [Drop also sells for about 0.79 per switch for 70 switches] | H112: of:=[.E112]/[.$E$141] -> 0.0438600134570496 | I112: of:=[.H112]*[.$R$109] -> 1.99957801350689 | J112: of:=[.H112]*[.$R$110] -> 1.91448958740021 | L112: of:=MROUND([.I112];0.01) -> 2 | M112: of:=MROUND([.J112];0.01)+0.01 -> 1.92 | N112: of:=MROUND( ([.I112]-[.L112])*10000 ;0.01) -> -4.22 | O112: of:=MROUND( ([.J112]-[.M112])*10000 ;0.01) -> -55.1 | Q112: Average Item Cost (AUD) | R112: of:=[.R109]/[.D141] -> 1.4246875
A113: 2022-05-11 | B113: HippoKeys-US | C113: Everglide Crystal Violet | D113: 1 | E113: of:=[.E112] -> 0.88 | F113: Not sold. Guessed using Aqua King. | H113: of:=[.E113]/[.$E$141] -> 0.0438600134570496 | I113: of:=[.H113]*[.$R$109] -> 1.99957801350689 | J113: of:=[.H113]*[.$R$110] -> 1.91448958740021 | L113: of:=MROUND([.I113];0.01) -> 2 | M113: of:=MROUND([.J113];0.01)+0.01 -> 1.92 | N113: of:=MROUND( ([.I113]-[.L113])*10000 ;0.01) -> -4.22 | O113: of:=MROUND( ([.J113]-[.M113])*10000 ;0.01) -> -55.1 | Q113: Average Shipping Cost (AUD) | R113: of:=[.R110]/[.D141] -> 1.3640625
A114: 2022-05-11 | B114: HippoKeys-US | C114: Everglide Oreo | D114: 1 | E114: of:=[.E113] -> 0.88 | F114: Not sold. Guessed using Aqua King. | H114: of:=[.E114]/[.$E$141] -> 0.0438600134570496 | I114: of:=[.H114]*[.$R$109] -> 1.99957801350689 | J114: of:=[.H114]*[.$R$110] -> 1.91448958740021 | L114: of:=MROUND([.I114];0.01) -> 2 | M114: of:=MROUND([.J114];0.01)+0.01 -> 1.92 | N114: of:=MROUND( ([.I114]-[.L114])*10000 ;0.01) -> -4.22 | O114: of:=MROUND( ([.J114]-[.M114])*10000 ;0.01) -> -55.1
A115: 2022-05-11 | B115: HippoKeys-US | C115: Gateron Box Ink V2 (Pink) | D115: 1 | E115: of:=15.3/18 -> 0.85 | F115: Not sold. Guessed using Divinikey price. | H115: of:=[.E115]/[.$E$141] -> 0.0423647857255593 | I115: of:=[.H115]*[.$R$109] -> 1.93141058122825 | J115: of:=[.H115]*[.$R$110] -> 1.84922289692066 | L115: of:=MROUND([.I115];0.01) -> 1.93 | M115: of:=MROUND([.J115];0.01) -> 1.85 | N115: of:=MROUND( ([.I115]-[.L115])*10000 ;0.01) -> 14.11 | O115: of:=MROUND( ([.J115]-[.M115])*10000 ;0.01) -> -7.77
A116: 2022-05-11 | B116: HippoKeys-US | C116: Gateron Cap V2 (Golden Yellow) | D116: 1 | E116: of:=8.64/18 -> 0.48 | F116: Not sold. Guessed using Divinikey price. | H116: of:=[.E116]/[.$E$141] -> 0.0239236437038452 | I116: of:=[.H116]*[.$R$109] -> 1.0906789164583 | J116: of:=[.H116]*[.$R$110] -> 1.04426704767284 | L116: of:=MROUND([.I116];0.01) -> 1.09 | M116: of:=MROUND([.J116];0.01) -> 1.04 | N116: of:=MROUND( ([.I116]-[.L116])*10000 ;0.01) -> 6.79 | O116: of:=MROUND( ([.J116]-[.M116])*10000 ;0.01) -> 42.67
A117: 2022-05-11 | B117: HippoKeys-US | C117: Gateron China Joy | D117: 1 | E117: of:=5.99/10 -> 0.599 | F117: [NovelKeys also sells for 0.6 each] | H117: of:=[.E117]/[.$E$141] -> 0.0298547137054235 | I117: of:=[.H117]*[.$R$109] -> 1.36107639783026 | J117: of:=[.H117]*[.$R$110] -> 1.30315825324174 | L117: of:=MROUND([.I117];0.01) -> 1.36 | M117: of:=MROUND([.J117];0.01) -> 1.3 | N117: of:=MROUND( ([.I117]-[.L117])*10000 ;0.01) -> 10.76 | O117: of:=MROUND( ([.J117]-[.M117])*10000 ;0.01) -> 31.58
A118: 2022-05-11 | B118: HippoKeys-US | C118: Gateron Ink V2 (Red) | D118: 1 | E118: of:=([.E119]+[.E120])/2 -> 0.7375 | F118: Not sold. Guessed using the other inks. | H118: of:=[.E118]/[.$E$141] -> 0.0367576817324705 | I118: of:=[.H118]*[.$R$109] -> 1.67578271018333 | J118: of:=[.H118]*[.$R$110] -> 1.60447280762234 | L118: of:=MROUND([.I118];0.01) -> 1.68 | M118: of:=MROUND([.J118];0.01) -> 1.6 | N118: of:=MROUND( ([.I118]-[.L118])*10000 ;0.01) -> -42.17 | O118: of:=MROUND( ([.J118]-[.M118])*10000 ;0.01) -> 44.73
A119: 2022-05-11 | B119: HippoKeys-US | C119: Gateron Ink V2 (Black) | D119: 1 | E119: of:=7.45/10 -> 0.745 | F119: [Normal price 7.50 each, Divinikey also sells for 7.50 each, and Ashkeebs at 0.75 each, and Prevail Key Co. 110 pieces at 0.75 each] | G119: . | H119: of:=[.E119]/[.$E$141] -> 0.0371314886653431 | I119: of:=[.H119]*[.$R$109] -> 1.69282456825299 | J119: of:=[.H119]*[.$R$110] -> 1.62078948024223 | L119: of:=MROUND([.I119];0.01) -> 1.69 | M119: of:=MROUND([.J119];0.01) -> 1.62 | N119: of:=MROUND( ([.I119]-[.L119])*10000 ;0.01) -> 28.25 | O119: of:=MROUND( ([.J119]-[.M119])*10000 ;0.01) -> 7.89
A120: 2022-05-11 | B120: HippoKeys-US | C120: Gateron Ink V2 (Blue) | D120: 1 | E120: of:=7.3/10 -> 0.73 | F120: [Krepublic also sells for 7.30 each at 110 pieces] | H120: of:=[.E120]/[.$E$141] -> 0.0363838747995979 | I120: of:=[.H120]*[.$R$109] -> 1.65874085211367 | J120: of:=[.H120]*[.$R$110] -> 1.58815613500245 | L120: of:=MROUND([.I120];0.01) -> 1.66 | M120: of:=MROUND([.J120];0.01) -> 1.59 | N120: of:=MROUND( ([.I120]-[.L120])*10000 ;0.01) -> -12.59 | O120: of:=MROUND( ([.J120]-[.M120])*10000 ;0.01) -> -18.44
A121: 2022-05-11 | B121: HippoKeys-US | C121: Gateron Mochi | D121: 1 | E121: of:=4.7/10 -> 0.47 | F121: Not sold. Guessed using Ashkeebs price. | H121: of:=[.E121]/[.$E$141] -> 0.0234252344600151 | I121: of:=[.H121]*[.$R$109] -> 1.06795643903209 | J121: of:=[.H121]*[.$R$110] -> 1.02251148417966 | L121: of:=MROUND([.I121];0.01) -> 1.07 | M121: of:=MROUND([.J121];0.01) -> 1.02 | N121: of:=MROUND( ([.I121]-[.L121])*10000 ;0.01) -> -20.44 | O121: of:=MROUND( ([.J121]-[.M121])*10000 ;0.01) -> 25.11
A122: 2022-05-11 | B122: HippoKeys-US | C122: Gateron Oil King | D122: 1 | E122: of:=6.45/10 -> 0.645 | H122: of:=[.E122]/[.$E$141] -> 0.032147396227042 | I122: of:=[.H122]*[.$R$109] -> 1.46559979399085 | J122: of:=[.H122]*[.$R$110] -> 1.40323384531038 | L122: of:=MROUND([.I122];0.01) -> 1.47 | M122: of:=MROUND([.J122];0.01) -> 1.4 | N122: of:=MROUND( ([.I122]-[.L122])*10000 ;0.01) -> -44 | O122: of:=MROUND( ([.J122]-[.M122])*10000 ;0.01) -> 32.34
A123: 2022-05-11 | B123: HippoKeys-US | C123: Gazzew Bobagum (62g) | D123: 1 | E123: of:=6.5/10 -> 0.65 | F123: Not sold. Guessed using Ashkeebs price. | H123: of:=[.E123]/[.$E$141] -> 0.0323966008489571 | I123: of:=[.H123]*[.$R$109] -> 1.47696103270395 | J123: of:=[.H123]*[.$R$110] -> 1.41411162705698 | L123: of:=MROUND([.I123];0.01) -> 1.48 | M123: of:=MROUND([.J123];0.01) -> 1.41 | N123: of:=MROUND( ([.I123]-[.L123])*10000 ;0.01) -> -30.39 | O123: of:=MROUND( ([.J123]-[.M123])*10000 ;0.01) -> 41.12
A124: 2022-05-11 | B124: HippoKeys-US | C124: Gazzew Boba U4T (68g) | D124: 1 | E124: of:=6.5/10 -> 0.65 | F124: Not sold. Guessed using Ashkeebs price. [Swagkeys also sells for 6.5 each] | G124: . | H124: of:=[.E124]/[.$E$141] -> 0.0323966008489571 | I124: of:=[.H124]*[.$R$109] -> 1.47696103270395 | J124: of:=[.H124]*[.$R$110] -> 1.41411162705698 | L124: of:=MROUND([.I124];0.01) -> 1.48 | M124: of:=MROUND([.J124];0.01) -> 1.41 | N124: of:=MROUND( ([.I124]-[.L124])*10000 ;0.01) -> -30.39 | O124: of:=MROUND( ([.J124]-[.M124])*10000 ;0.01) -> 41.12
A125: 2022-05-11 | B125: HippoKeys-US | C125: Glorious Lynx | D125: 1 | E125: of:=24.99/36 -> 0.694166666666667 | F125: Not sold. Guessed using Divinikey price. | H125: of:=[.E125]/[.$E$141] -> 0.03459790834254 | I125: of:=[.H125]*[.$R$109] -> 1.5773186413364 | J125: of:=[.H125]*[.$R$110] -> 1.51019869915187 | L125: of:=MROUND([.I125];0.01) -> 1.58 | M125: of:=MROUND([.J125];0.01) -> 1.51 | N125: of:=MROUND( ([.I125]-[.L125])*10000 ;0.01) -> -26.81 | O125: of:=MROUND( ([.J125]-[.M125])*10000 ;0.01) -> 1.99
A126: 2022-05-11 | B126: HippoKeys-US | C126: Glorious Panda | D126: 1 | E126: of:=24.99/36 -> 0.694166666666667 | F126: Not sold. Guessed using Divinikey price. | H126: of:=[.E126]/[.$E$141] -> 0.03459790834254 | I126: of:=[.H126]*[.$R$109] -> 1.5773186413364 | J126: of:=[.H126]*[.$R$110] -> 1.51019869915187 | L126: of:=MROUND([.I126];0.01) -> 1.58 | M126: of:=MROUND([.J126];0.01) -> 1.51 | N126: of:=MROUND( ([.I126]-[.L126])*10000 ;0.01) -> -26.81 | O126: of:=MROUND( ([.J126]-[.M126])*10000 ;0.01) -> 1.99
A127: 2022-05-11 | B127: HippoKeys-US | C127: GoPolar Azure Dragon | D127: 1 | E127: of:=6.49/10 -> 0.649 | H127: of:=[.E127]/[.$E$141] -> 0.0323467599245741 | I127: of:=[.H127]*[.$R$109] -> 1.47468878496133 | J127: of:=[.H127]*[.$R$110] -> 1.41193607070766 | L127: of:=MROUND([.I127];0.01)-0.01 -> 1.46 | M127: of:=MROUND([.J127];0.01) -> 1.41 | N127: of:=MROUND( ([.I127]-[.L127])*10000 ;0.01) -> 146.89 | O127: of:=MROUND( ([.J127]-[.M127])*10000 ;0.01) -> 19.36
A128: 2022-05-11 | B128: HippoKeys-US | C128: Joininkeys Matcha | D128: 1 | E128: of:=66/110 -> 0.6 | F128: Not sold. Guessed using prevail key co. 110-piece price. | H128: of:=[.E128]/[.$E$141] -> 0.0299045546298065 | I128: of:=[.H128]*[.$R$109] -> 1.36334864557288 | J128: of:=[.H128]*[.$R$110] -> 1.30533380959105 | L128: of:=MROUND([.I128];0.01) -> 1.36 | M128: of:=MROUND([.J128];0.01) -> 1.31 | N128: of:=MROUND( ([.I128]-[.L128])*10000 ;0.01) -> 33.49 | O128: of:=MROUND( ([.J128]-[.M128])*10000 ;0.01) -> -46.66
A129: 2022-05-11 | B129: HippoKeys-US | C129: Kaihua Halo True | D129: 1 | E129: of:=(35/70)*1.11 -> 0.555 | F129: Not sold. Guessed using Drop price, multiplied by 1.11. | H129: of:=[.E129]/[.$E$141] -> 0.027661713032571 | I129: of:=[.H129]*[.$R$109] -> 1.26109749715491 | J129: of:=[.H129]*[.$R$110] -> 1.20743377387173 | L129: of:=MROUND([.I129];0.01) -> 1.26 | M129: of:=MROUND([.J129];0.01) -> 1.21 | N129: of:=MROUND( ([.I129]-[.L129])*10000 ;0.01) -> 10.97 | O129: of:=MROUND( ([.J129]-[.M129])*10000 ;0.01) -> -25.66
A130: 2022-05-11 | B130: HippoKeys-US | C130: Kailh Box (White) | D130: 1 | E130: of:=10.8/36 -> 0.3 | F130: Not sold. Guessed using NovelKeys price. | H130: of:=[.E130]/[.$E$141] -> 0.0149522773149033 | I130: of:=[.H130]*[.$R$109] -> 0.68167432278644 | J130: of:=[.H130]*[.$R$110] -> 0.652666904795527 | L130: of:=MROUND([.I130];0.01) -> 0.68 | M130: of:=MROUND([.J130];0.01) -> 0.65 | N130: of:=MROUND( ([.I130]-[.L130])*10000 ;0.01) -> 16.74 | O130: of:=MROUND( ([.J130]-[.M130])*10000 ;0.01) -> 26.67
A131: 2022-05-11 | B131: HippoKeys-US | C131: Kailh Box (Royal) | D131: 1 | E131: of:=5/10 -> 0.5 | F131: Not sold. Guessed using Divinikey price. | H131: of:=[.E131]/[.$E$141] -> 0.0249204621915054 | I131: of:=[.H131]*[.$R$109] -> 1.13612387131073 | J131: of:=[.H131]*[.$R$110] -> 1.08777817465921 | L131: of:=MROUND([.I131];0.01) -> 1.14 | M131: of:=MROUND([.J131];0.01) -> 1.09 | N131: of:=MROUND( ([.I131]-[.L131])*10000 ;0.01) -> -38.76 | O131: of:=MROUND( ([.J131]-[.M131])*10000 ;0.01) -> -22.22
A132: 2022-05-11 | B132: HippoKeys-US | C132: Kinetic Labs Penguin | D132: 1 | E132: of:=67.1/110 -> 0.61 | F132: Not sold. Guessed using Kinetic Labs 110-piece price. (I have no frame of reference for Kinetic Labs prices. I’m using their prices as-is.) | G132: . | H132: of:=[.E132]/[.$E$141] -> 0.0304029638736366 | I132: of:=[.H132]*[.$R$109] -> 1.38607112299909 | J132: of:=[.H132]*[.$R$110] -> 1.32708937308424 | L132: of:=MROUND([.I132];0.01) -> 1.39 | M132: of:=MROUND([.J132];0.01) -> 1.33 | N132: of:=MROUND( ([.I132]-[.L132])*10000 ;0.01) -> -39.29 | O132: of:=MROUND( ([.J132]-[.M132])*10000 ;0.01) -> -29.11
A133: 2022-05-11 | B133: HippoKeys-US | C133: Kinetic Labs Salmon | D133: 1 | E133: of:=52.8/110 -> 0.48 | F133: Not sold. Guessed using Kinetic Labs 110-piece price. (I have no frame of reference for Kinetic Labs prices. I’m using their prices as-is.) | G133: . | H133: of:=[.E133]/[.$E$141] -> 0.0239236437038452 | I133: of:=[.H133]*[.$R$109] -> 1.0906789164583 | J133: of:=[.H133]*[.$R$110] -> 1.04426704767284 | L133: of:=MROUND([.I133];0.01) -> 1.09 | M133: of:=MROUND([.J133];0.01) -> 1.04 | N133: of:=MROUND( ([.I133]-[.L133])*10000 ;0.01) -> 6.79 | O133: of:=MROUND( ([.J133]-[.M133])*10000 ;0.01) -> 42.67
A134: 2022-05-11 | B134: HippoKeys-US | C134: NovelKeys x Kailh Cream | D134: 1 | E134: of:=11.7/18 -> 0.65 | H134: of:=[.E134]/[.$E$141] -> 0.0323966008489571 | I134: of:=[.H134]*[.$R$109] -> 1.47696103270395 | J134: of:=[.H134]*[.$R$110] -> 1.41411162705698 | L134: of:=MROUND([.I134];0.01) -> 1.48 | M134: of:=MROUND([.J134];0.01) -> 1.41 | N134: of:=MROUND( ([.I134]-[.L134])*10000 ;0.01) -> -30.39 | O134: of:=MROUND( ([.J134]-[.M134])*10000 ;0.01) -> 41.12
A135: 2022-05-11 | B135: HippoKeys-US | C135: NovelKeys x Kailh Cream Tactile | D135: 1 | E135: of:=11.7/18 -> 0.65 | H135: of:=[.E135]/[.$E$141] -> 0.0323966008489571 | I135: of:=[.H135]*[.$R$109] -> 1.47696103270395 | J135: of:=[.H135]*[.$R$110] -> 1.41411162705698 | L135: of:=MROUND([.I135];0.01) -> 1.48 | M135: of:=MROUND([.J135];0.01) -> 1.41 | N135: of:=MROUND( ([.I135]-[.L135])*10000 ;0.01) -> -30.39 | O135: of:=MROUND( ([.J135]-[.M135])*10000 ;0.01) -> 41.12
A136: 2022-05-11 | B136: HippoKeys-US | C136: NovelKeys Silk (Olivia) | D136: 1 | E136: of:=19.8/36 -> 0.55 | F136: Not sold. Guessed using NovelKeys price. | H136: of:=[.E136]/[.$E$141] -> 0.027412508410656 | I136: of:=[.H136]*[.$R$109] -> 1.24973625844181 | J136: of:=[.H136]*[.$R$110] -> 1.19655599212513 | L136: of:=MROUND([.I136];0.01) -> 1.25 | M136: of:=MROUND([.J136];0.01) -> 1.2 | N136: of:=MROUND( ([.I136]-[.L136])*10000 ;0.01) -> -2.64 | O136: of:=MROUND( ([.J136]-[.M136])*10000 ;0.01) -> -34.44
A137: 2022-05-11 | B137: HippoKeys-US | C137: NovelKeys x Kailh Box (Jade) | D137: 1 | E137: of:=6.3/18 -> 0.35 | F137: Not sold. Guessed using Divinikey price. | H137: of:=[.E137]/[.$E$141] -> 0.0174443235340538 | I137: of:=[.H137]*[.$R$109] -> 0.795286709917513 | J137: of:=[.H137]*[.$R$110] -> 0.761444722261449 | L137: of:=MROUND([.I137];0.01)-0.01 -> 0.79 | M137: of:=MROUND([.J137];0.01) -> 0.76 | N137: of:=MROUND( ([.I137]-[.L137])*10000 ;0.01) -> 52.87 | O137: of:=MROUND( ([.J137]-[.M137])*10000 ;0.01) -> 14.45
A138: 2022-05-11 | B138: HippoKeys-US | C138: Prime Keyboards Alpaca | D138: 1 | E138: of:=6/10 -> 0.6 | F138: Not sold. Guessed using Swagkeys price. | H138: of:=[.E138]/[.$E$141] -> 0.0299045546298065 | I138: of:=[.H138]*[.$R$109] -> 1.36334864557288 | J138: of:=[.H138]*[.$R$110] -> 1.30533380959105 | L138: of:=MROUND([.I138];0.01) -> 1.36 | M138: of:=MROUND([.J138];0.01) -> 1.31 | N138: of:=MROUND( ([.I138]-[.L138])*10000 ;0.01) -> 33.49 | O138: of:=MROUND( ([.J138]-[.M138])*10000 ;0.01) -> -46.66
A139: 2022-05-11 | B139: HippoKeys-US | C139: Tecsee Purple Panda | D139: 1 | E139: of:=5.5/10 -> 0.55 | H139: of:=[.E139]/[.$E$141] -> 0.027412508410656 | I139: of:=[.H139]*[.$R$109] -> 1.24973625844181 | J139: of:=[.H139]*[.$R$110] -> 1.19655599212513 | L139: of:=MROUND([.I139];0.01) -> 1.25 | M139: of:=MROUND([.J139];0.01) -> 1.2 | N139: of:=MROUND( ([.I139]-[.L139])*10000 ;0.01) -> -2.64 | O139: of:=MROUND( ([.J139]-[.M139])*10000 ;0.01) -> -34.44
A140: 2022-05-11 | B140: HippoKeys-US | C140: Tecsee Sapphire V2 | D140: 1 | E140: of:=5.5/10 -> 0.55 | H140: of:=[.E140]/[.$E$141] -> 0.027412508410656 | I140: of:=[.H140]*[.$R$109] -> 1.24973625844181 | J140: of:=[.H140]*[.$R$110] -> 1.19655599212513 | L140: of:=MROUND([.I140];0.01) -> 1.25 | M140: of:=MROUND([.J140];0.01) -> 1.2 | N140: of:=MROUND( ([.I140]-[.L140])*10000 ;0.01) -> -2.64 | O140: of:=MROUND( ([.J140]-[.M140])*10000 ;0.01) -> -34.44
C141: (TOTAL) | D141: of:=SUM([.D109:.D140]) -> 32 | E141: of:=SUM([.E109:.E140]) -> 20.0638333333333 | H141: of:=SUM([.H109:.H140]) -> 1 | I141: of:=SUM([.I109:.I140]) -> 45.59 | J141: of:=SUM([.J109:.J140]) -> 43.65 | L141: of:=SUM([.L109:.L140]) -> 45.59 | M141: of:=SUM([.M109:.M140]) -> 43.65